{
  "$schema": "https://5thelement.ai/schemas/proof.json",
  "version": "1.1",
  "generated_at": "2026-10-07T13:29:46.631Z",
  "issuer": {
    "legal_name": "AIVENTURE S.R.L.",
    "cui": "51415878",
    "euid": "ROONRC.J2025016406000",
    "service": "3webs",
    "domain": "3webobs.com",
    "contact": "contact@5thelement.ai"
  },
  "integrity_method": {
    "algorithm": "SHA-256",
    "digest_encoding": "lowercase hexadecimal",
    "file_scope": "raw response-body bytes of each designated public artifact as served at generation time",
    "aggregate": {
      "algorithm": "SHA-256",
      "line_format": "<path>:<sha256>",
      "sort": "lexicographic ascending by path",
      "encoding": "UTF-8",
      "line_separator": "LF",
      "trailing_newline": false
    }
  },
  "aggregate_sha256": "3b328d244a791b0f90e186254a9fa31f5de9f0810e02239224bd86c1e3b56142",
  "file_count": 23,
  "files": [
    {
      "path": "/.well-known/agent-card.json",
      "url": "https://3webobs.com/.well-known/agent-card.json",
      "bytes": 6258,
      "sha256": "38c0f53f4b06748dfc994f77086a4841d39035c2e4ad265ddeb3d62bc1a8e6ef"
    },
    {
      "path": "/.well-known/security.txt",
      "url": "https://3webobs.com/.well-known/security.txt",
      "bytes": 362,
      "sha256": "355fe58370fabaf6b5b318402784997a3988fb17e8612b625729ddbdce624497"
    },
    {
      "path": "/actions.json",
      "url": "https://3webobs.com/actions.json",
      "bytes": 3756,
      "sha256": "409e35eb1e073cf31fac5696825ec7bf179ef4b05d513ed1b43c764e00fa3a39"
    },
    {
      "path": "/adn.json",
      "url": "https://3webobs.com/adn.json",
      "bytes": 5385,
      "sha256": "24ebf2039b9f9011f260e34f1f4532c4c1981e2e47e2e5a4e5338d1dc0a5d0ba"
    },
    {
      "path": "/ai.json",
      "url": "https://3webobs.com/ai.json",
      "bytes": 7616,
      "sha256": "54bf9d3280db68b802e648da22ef688be0dd2956aa305b6b1b6188dd2216e708"
    },
    {
      "path": "/ai.txt",
      "url": "https://3webobs.com/ai.txt",
      "bytes": 7569,
      "sha256": "e0379abcaa4e02bf0198f214f5893a25802b91a23b29418ec919a3120d08015b"
    },
    {
      "path": "/aliases.json",
      "url": "https://3webobs.com/aliases.json",
      "bytes": 4181,
      "sha256": "8dc12637efdcee062aeb78c6e5a3326e07b1130903be381f71c2ac433eb30fb7"
    },
    {
      "path": "/allow-lane-matrix.json",
      "url": "https://3webobs.com/allow-lane-matrix.json",
      "bytes": 3549,
      "sha256": "73806e0c9b4fdebd6d0c7fa403dc360dc4f4f5ba3c257ebc258c0bbceea71ad8"
    },
    {
      "path": "/assets/og-cover.png",
      "url": "https://3webobs.com/assets/og-cover.png",
      "bytes": 45084,
      "sha256": "660dac08848a1905d137dce27fd27ac4222894309f8e0340dc7bc0bf5c7c932b"
    },
    {
      "path": "/authority.json",
      "url": "https://3webobs.com/authority.json",
      "bytes": 7339,
      "sha256": "383fc075e885ad4e836d415c588601a00e4d0f6cfdb038a3f1cec857a2a642d8"
    },
    {
      "path": "/capabilities.json",
      "url": "https://3webobs.com/capabilities.json",
      "bytes": 9821,
      "sha256": "ba5b9371727359eb821ed38c8324401462feb595c22cb116bc19e5bbaff77f5e"
    },
    {
      "path": "/changelog.json",
      "url": "https://3webobs.com/changelog.json",
      "bytes": 8219,
      "sha256": "3433d3b667cdea654356e4a0b3c9c11ea899e1aca9828ef7f96f8a5cc35f233b"
    },
    {
      "path": "/entities.json",
      "url": "https://3webobs.com/entities.json",
      "bytes": 6365,
      "sha256": "56e808dcd382df630a8830071da6bc14aa65be8e4abc8d1d44863468ffacd3ba"
    },
    {
      "path": "/governance.json",
      "url": "https://3webobs.com/governance.json",
      "bytes": 7959,
      "sha256": "72824ecf4dc1c8efa6a2cb69dfd460466056e3373528729825ad9aadeef29193"
    },
    {
      "path": "/humans.txt",
      "url": "https://3webobs.com/humans.txt",
      "bytes": 740,
      "sha256": "3204072f0a249cde037832d6ec5f7c2b09b841456c754e5d99a924f84292fb49"
    },
    {
      "path": "/intents.json",
      "url": "https://3webobs.com/intents.json",
      "bytes": 14920,
      "sha256": "dbc1a0d7538101326034b517ce807ba21684836cac23d359e06677368918f513"
    },
    {
      "path": "/llms.txt",
      "url": "https://3webobs.com/llms.txt",
      "bytes": 2549,
      "sha256": "2cf0fe9b3aada7d2f32de173a8b7d8afdff05d899a25626449e2aa92cf609cba"
    },
    {
      "path": "/network.json",
      "url": "https://3webobs.com/network.json",
      "bytes": 3171,
      "sha256": "b099a337e8a19e89ce991ecc5c81d9b2318fd892e44848248c66fff150faecec"
    },
    {
      "path": "/policy.json",
      "url": "https://3webobs.com/policy.json",
      "bytes": 1310,
      "sha256": "f3be229a4f00b915715c45ce5f8da73340da2e7159df16c941a1cc386795f125"
    },
    {
      "path": "/robots.txt",
      "url": "https://3webobs.com/robots.txt",
      "bytes": 2485,
      "sha256": "e4c1437305b7fd184ada0be57bdaf11a95b016070cdfd7a10513007ec19e48a2"
    },
    {
      "path": "/session.json",
      "url": "https://3webobs.com/session.json",
      "bytes": 5674,
      "sha256": "59f327fbc46e3d9ad722db23a11111ff3aac8919156b11b40e87c85558abe059"
    },
    {
      "path": "/site.webmanifest",
      "url": "https://3webobs.com/site.webmanifest",
      "bytes": 552,
      "sha256": "1f26a8613ff0c0343588f81ad195c6c0bde7fd9847453a70a2646547beb6a7bc"
    },
    {
      "path": "/sitemap.xml",
      "url": "https://3webobs.com/sitemap.xml",
      "bytes": 8028,
      "sha256": "45f2d85c4a08c8e2d16cece5439c8911ca4b6186774b9b91bcc2bc89c15a5e9e"
    }
  ],
  "verification": {
    "artifact": "Fetch the declared URL as raw bytes, compute SHA-256, encode as lowercase hexadecimal and compare with the recorded sha256.",
    "aggregate": "Sort entries lexicographically by path, create path:sha256 lines, join with LF and no trailing newline, then compute SHA-256.",
    "interpretation": "A matching artifact digest demonstrates byte-for-byte consistency with the artifact represented by this manifest. A matching aggregate demonstrates internal consistency of the recorded file-digest set."
  },
  "external_anchoring": {
    "timestamp_authority": false,
    "opens_timestamp": false,
    "digital_signature": false,
    "statement": "This manifest currently provides cryptographic integrity evidence only."
  },
  "evidence_scope": {
    "proves": [
      "byte-level consistency of an artifact with the digest recorded in this manifest",
      "internal consistency of the recorded file-digest set when the aggregate verifies"
    ],
    "does_not_prove": [
      "truthfulness of the content",
      "regulatory compliance",
      "legal validity",
      "authorship by itself",
      "publication time by itself",
      "third-party endorsement"
    ]
  }
}
