{
  "$schema": "https://3webobs.com/schemas/proof.json",
  "version": "1.1",
  "generated_at": "2026-08-30T14:30:00.000Z",
  "issuer": {
    "legal_name": "AIVENTURE S.R.L.",
    "cui": "51415878",
    "euid": "ROONRC.J2025016406000",
    "service": "3webs",
    "domain": "3webobs.com",
    "contact": "contact@5thelement.ai"
  },
  "integrity_method": {
    "algorithm": "SHA-256",
    "digest_encoding": "lowercase hexadecimal",
    "file_scope": "raw response-body bytes of each designated public artifact as served at generation time",
    "aggregate": {
      "algorithm": "SHA-256",
      "line_format": "<path>:<sha256>",
      "sort": "lexicographic ascending by path",
      "encoding": "UTF-8",
      "line_separator": "LF",
      "trailing_newline": false
    }
  },
  "aggregate_sha256": "695f44181e03dce6a6f8d2df5d6fc088511995f445602da6ef63fe68b4ddcf4a",
  "file_count": 35,
  "files": [
    {
      "path": "/.well-known/agent-card.json",
      "url": "https://3webobs.com/.well-known/agent-card.json",
      "bytes": 5810,
      "sha256": "2d62a5d877f4790a674b888439acfbf91d66591ae541b362c61c5d49737ff78c"
    },
    {
      "path": "/.well-known/security.txt",
      "url": "https://3webobs.com/.well-known/security.txt",
      "bytes": 362,
      "sha256": "355fe58370fabaf6b5b318402784997a3988fb17e8612b625729ddbdce624497"
    },
    {
      "path": "/404.html",
      "url": "https://3webobs.com/404.html",
      "bytes": 1326,
      "sha256": "c168e100a3c63d02d7688d18e99363b723e5e378e8fe9f6e7df884d246446eab"
    },
    {
      "path": "/actions.json",
      "url": "https://3webobs.com/actions.json",
      "bytes": 3756,
      "sha256": "409e35eb1e073cf31fac5696825ec7bf179ef4b05d513ed1b43c764e00fa3a39"
    },
    {
      "path": "/adn.json",
      "url": "https://3webobs.com/adn.json",
      "bytes": 5385,
      "sha256": "24ebf2039b9f9011f260e34f1f4532c4c1981e2e47e2e5a4e5338d1dc0a5d0ba"
    },
    {
      "path": "/ai-act.html",
      "url": "https://3webobs.com/ai-act.html",
      "bytes": 58056,
      "sha256": "6a71416cb29a103181cd8b3cca3e671363890d041a2e3a90b66cccf0edc21a9e"
    },
    {
      "path": "/ai.json",
      "url": "https://3webobs.com/ai.json",
      "bytes": 7443,
      "sha256": "c876ca5155c1e2605af9eb995de9d9d5c83011d0876d692aaee431de0586c1fb"
    },
    {
      "path": "/ai.txt",
      "url": "https://3webobs.com/ai.txt",
      "bytes": 7568,
      "sha256": "bdf23f00b2578ca4e40e6e8fd68df79d032c6e5dfd9adcb6e335b59b8daecb0b"
    },
    {
      "path": "/aliases.json",
      "url": "https://3webobs.com/aliases.json",
      "bytes": 4181,
      "sha256": "8dc12637efdcee062aeb78c6e5a3326e07b1130903be381f71c2ac433eb30fb7"
    },
    {
      "path": "/allow-lane-matrix.json",
      "url": "https://3webobs.com/allow-lane-matrix.json",
      "bytes": 3549,
      "sha256": "73806e0c9b4fdebd6d0c7fa403dc360dc4f4f5ba3c257ebc258c0bbceea71ad8"
    },
    {
      "path": "/assets/og-cover.png",
      "url": "https://3webobs.com/assets/og-cover.png",
      "bytes": 45084,
      "sha256": "660dac08848a1905d137dce27fd27ac4222894309f8e0340dc7bc0bf5c7c932b"
    },
    {
      "path": "/authority.json",
      "url": "https://3webobs.com/authority.json",
      "bytes": 7339,
      "sha256": "383fc075e885ad4e836d415c588601a00e4d0f6cfdb038a3f1cec857a2a642d8"
    },
    {
      "path": "/capabilities.json",
      "url": "https://3webobs.com/capabilities.json",
      "bytes": 8085,
      "sha256": "84e848eda82b65220bf63d3bb8e8bfd89772cc9efb1d2d27b20bbdb884285ca3"
    },
    {
      "path": "/changelog.json",
      "url": "https://3webobs.com/changelog.json",
      "bytes": 8219,
      "sha256": "3433d3b667cdea654356e4a0b3c9c11ea899e1aca9828ef7f96f8a5cc35f233b"
    },
    {
      "path": "/contact.html",
      "url": "https://3webobs.com/contact.html",
      "bytes": 55433,
      "sha256": "1aae0080c1ea45e2662d4b621a9fdd627c62f1a6ddd2e654954e4a71311c84c1"
    },
    {
      "path": "/cookies.html",
      "url": "https://3webobs.com/cookies.html",
      "bytes": 55292,
      "sha256": "88bf517b6fbcc4d310bb2563acec0dfcfd07d2d9c3128da429efe7e769f1f5b1"
    },
    {
      "path": "/entities.json",
      "url": "https://3webobs.com/entities.json",
      "bytes": 6372,
      "sha256": "694d9e4e1dd1a9cca774c2ed5d5de8195b0aa18a5fc570bdc7c439301723a012"
    },
    {
      "path": "/for-ai-teams.html",
      "url": "https://3webobs.com/for-ai-teams.html",
      "bytes": 18903,
      "sha256": "c23914f8964db6b03711e4685ddbd4098c562a43c278590737fb77cdf406e182"
    },
    {
      "path": "/for-compliance-consultants.html",
      "url": "https://3webobs.com/for-compliance-consultants.html",
      "bytes": 19205,
      "sha256": "8f40bfd084d68d70a15e9080109476667ad10b6f963c4d999d8593b2a288c142"
    },
    {
      "path": "/for-seo-agencies.html",
      "url": "https://3webobs.com/for-seo-agencies.html",
      "bytes": 18995,
      "sha256": "02acb3b9f76208f757e89c140959c1521bbc94fd37d7e9ea5c079d2036d18f18"
    },
    {
      "path": "/gdpr.html",
      "url": "https://3webobs.com/gdpr.html",
      "bytes": 59790,
      "sha256": "a4b94adb2427d2cff011c684776b5d22e48cd36fe95da28ab5a0afc3db3e9f94"
    },
    {
      "path": "/governance.json",
      "url": "https://3webobs.com/governance.json",
      "bytes": 7966,
      "sha256": "8a10388defa57fed63b5a6d9541bea0d45d15dbb307e49036c41c1957137eeb5"
    },
    {
      "path": "/humans.txt",
      "url": "https://3webobs.com/humans.txt",
      "bytes": 740,
      "sha256": "3204072f0a249cde037832d6ec5f7c2b09b841456c754e5d99a924f84292fb49"
    },
    {
      "path": "/index.html",
      "url": "https://3webobs.com/index.html",
      "bytes": 186876,
      "sha256": "17c17294841d26d599c0b9d2e05ddbe3e49db83f4bbc91a2ccd992df25a60442"
    },
    {
      "path": "/intents.json",
      "url": "https://3webobs.com/intents.json",
      "bytes": 14920,
      "sha256": "dbc1a0d7538101326034b517ce807ba21684836cac23d359e06677368918f513"
    },
    {
      "path": "/llms.txt",
      "url": "https://3webobs.com/llms.txt",
      "bytes": 2369,
      "sha256": "a86a316c523f90a28f943a062c66e976a52da952221f0e590252e93476bee626"
    },
    {
      "path": "/network.json",
      "url": "https://3webobs.com/network.json",
      "bytes": 3171,
      "sha256": "b099a337e8a19e89ce991ecc5c81d9b2318fd892e44848248c66fff150faecec"
    },
    {
      "path": "/policy.html",
      "url": "https://3webobs.com/policy.html",
      "bytes": 56575,
      "sha256": "ea3db0b9e5f85bb737bd2a837e5da82ce15b3cc5c524dc1beefce763e5fcd9bd"
    },
    {
      "path": "/policy.json",
      "url": "https://3webobs.com/policy.json",
      "bytes": 1310,
      "sha256": "f3be229a4f00b915715c45ce5f8da73340da2e7159df16c941a1cc386795f125"
    },
    {
      "path": "/robots.txt",
      "url": "https://3webobs.com/robots.txt",
      "bytes": 2485,
      "sha256": "e4c1437305b7fd184ada0be57bdaf11a95b016070cdfd7a10513007ec19e48a2"
    },
    {
      "path": "/self-audit.html",
      "url": "https://3webobs.com/self-audit.html",
      "bytes": 7686,
      "sha256": "eb020487c2f1ba773896b2df205a82f36862dd1056212c1906ed13eaf667c05d"
    },
    {
      "path": "/session.json",
      "url": "https://3webobs.com/session.json",
      "bytes": 5674,
      "sha256": "59f327fbc46e3d9ad722db23a11111ff3aac8919156b11b40e87c85558abe059"
    },
    {
      "path": "/site.webmanifest",
      "url": "https://3webobs.com/site.webmanifest",
      "bytes": 552,
      "sha256": "1f26a8613ff0c0343588f81ad195c6c0bde7fd9847453a70a2646547beb6a7bc"
    },
    {
      "path": "/sitemap.xml",
      "url": "https://3webobs.com/sitemap.xml",
      "bytes": 6020,
      "sha256": "9adf20822c9e8262a40e3f9e9e2b872efbb80f34406e9e326c6efe964dad8b88"
    },
    {
      "path": "/terms.html",
      "url": "https://3webobs.com/terms.html",
      "bytes": 61901,
      "sha256": "6ca27b2c5eb50ffffb561486fb35adf9f9291b52ad8c5682c242e7a69f96fa7c"
    }
  ],
  "verification": {
    "artifact": "Fetch the declared URL as raw bytes, compute SHA-256, encode as lowercase hexadecimal and compare with the recorded sha256.",
    "aggregate": "Sort entries lexicographically by path, create path:sha256 lines, join with LF and no trailing newline, then compute SHA-256.",
    "interpretation": "A matching artifact digest demonstrates byte-for-byte consistency with the artifact represented by this manifest. A matching aggregate demonstrates internal consistency of the recorded file-digest set."
  },
  "external_anchoring": {
    "timestamp_authority": false,
    "opens_timestamp": false,
    "digital_signature": false,
    "statement": "This manifest currently provides cryptographic integrity evidence only."
  },
  "evidence_scope": {
    "proves": [
      "byte-level consistency of an artifact with the digest recorded in this manifest",
      "internal consistency of the recorded file-digest set when the aggregate verifies"
    ],
    "does_not_prove": [
      "truthfulness of the content",
      "regulatory compliance",
      "legal validity",
      "authorship by itself",
      "publication time by itself",
      "third-party endorsement"
    ]
  }
}
